{
  "derived_model_version": "0.1.0",
  "artifact_type": "AmendmentMapping",
  "regulator_profile": "core",
  "records": [
    {
      "mapping_id": "fixture.amend.001",
      "guidance_family_id": "fixture.family.ich_s6",
      "source_document_edition_id": "fixture.edition.s6.parent",
      "amending_document_edition_id": "fixture.edition.s6.addendum",
      "source_record_ids": [
        "fixture.kr.parent"
      ],
      "amending_record_ids": [
        "fixture.kr.addendum"
      ],
      "relation_type": "clarifies",
      "mapped_scope": "Fixture amendment scope.",
      "analyst_rationale": "Fixture rationale preserving why the amendment relationship was assigned.",
      "original_relationship_wording": "clarifies",
      "contextual_cross_reference_ids": [],
      "contextual_cross_reference_note": null,
      "source_references": [
        {
          "document_id": "ich_s6_r1",
          "section_id": null,
          "source_unit_id": null
        }
      ],
      "review_status": "needs_review",
      "profile_details": null
    }
  ]
}
